{"argv":["python3","run_verifier.py","--spec","/Users/bgm/Documents/Documents - Brian’s MacBook Pro/New project/gravity_emergence_evidence_program/alpha_fundamental_record_action_cleanroom_v003/STAGE8_TASK6_A35_EVALUATOR_SPEC_LANE2_V005.md","--ledger","/Users/bgm/Documents/Documents - Brian’s MacBook Pro/New project/gravity_emergence_evidence_program/alpha_fundamental_record_action_cleanroom_v003/rd22_run_022/producer.ledger.json","--ledger-sha256","ed850d9b33827c07d9bd217aa0d41dd559b3d86084ace41c5d70ace98a200bfe","--evidence-dir","/Users/bgm/Documents/Documents - Brian’s MacBook Pro/New project/gravity_emergence_evidence_program/alpha_fundamental_record_action_cleanroom_v003/rd22_run_022/evidence","--runtime-snapshot","/Users/bgm/Documents/Documents - Brian’s MacBook Pro/New project/gravity_emergence_evidence_program/provenance/primitive_step6_runtime_snapshot_v012.json","--runtime-gate","/Users/bgm/Documents/Documents - Brian’s MacBook Pro/New project/gravity_emergence_evidence_program/primitive_step6_content_addressed_runtime_gate_v010.md"],"entry_point":"run_verifier.py","exit_contract":{"fail_closed":2,"faults_found":1,"verified":0},"input_roots":{"evidence_root_sha256":"e7820ca54197fad36d8d2dc4ecad92db9e75d9be0087918d55cb322a6abd1c9a","ledger_sha256":"ed850d9b33827c07d9bd217aa0d41dd559b3d86084ace41c5d70ace98a200bfe","runtime_gate_sha256":"2ad7f72a88184c11e1253f2c47598fca11e60d05e8e71a26db4e19b16bf98d42","runtime_snapshot_sha256":"50a6fc141a45451678aa7543e4f267ce26beb6e53182170b478acb6fb0e0f5bb","spec_sha256":"f8d1a7dc02798229f0ea22b0e855d1d09bb4a5b7eea9069c419357a56b6a067b"},"optimize":false,"output_path":"verifier.output.json","receipt_authoritative":false,"receipt_path":"verifier.receipt.json","schema":"rd22.verifier-manifest.v001","stdout_discipline":{"format":"canonical-json","lines":1,"other_output_permitted":false},"verifier_root_sha256":"dba5377d5ca1e7eebf2932da10e043e96c33f642cf06c8dd81cf26dff3bd3ac0"}