{"argv":["python3","run_verifier.py","--spec","/Users/bgm/Documents/Documents - Brian’s MacBook Pro/New project/gravity_emergence_evidence_program/alpha_fundamental_record_action_cleanroom_v003/STAGE8_TASK6_A35_EVALUATOR_SPEC_LANE2_V007.md","--ledger","/Users/bgm/Documents/Documents - Brian’s MacBook Pro/New project/gravity_emergence_evidence_program/alpha_fundamental_record_action_cleanroom_v003/rd22_run_030/producer.ledger.json","--ledger-sha256","83f09ce709f6572ea3f0a9fc07d07ea6f5427c3371989ab8e750cc427396f324","--evidence-dir","/Users/bgm/Documents/Documents - Brian’s MacBook Pro/New project/gravity_emergence_evidence_program/alpha_fundamental_record_action_cleanroom_v003/rd22_run_030/evidence","--runtime-snapshot","/Users/bgm/Documents/Documents - Brian’s MacBook Pro/New project/gravity_emergence_evidence_program/provenance/primitive_step6_runtime_snapshot_v012.json","--runtime-gate","/Users/bgm/Documents/Documents - Brian’s MacBook Pro/New project/gravity_emergence_evidence_program/primitive_step6_content_addressed_runtime_gate_v010.md"],"entry_point":"run_verifier.py","exit_contract":{"fail_closed":2,"faults_found":1,"verified":0},"input_roots":{"evidence_root_sha256":"fcaa97a01a9796a6313ce2f81f7710d9848ca972ede5699b84c914e09a15d364","ledger_sha256":"83f09ce709f6572ea3f0a9fc07d07ea6f5427c3371989ab8e750cc427396f324","runtime_gate_sha256":"2ad7f72a88184c11e1253f2c47598fca11e60d05e8e71a26db4e19b16bf98d42","runtime_snapshot_sha256":"50a6fc141a45451678aa7543e4f267ce26beb6e53182170b478acb6fb0e0f5bb","spec_sha256":"d38d31719b64839744a98da5ee005fb50119f9a26b2b98b0e1a1de445b5d4973"},"optimize":false,"output_path":"verifier.output.json","receipt_authoritative":false,"receipt_path":"verifier.receipt.json","schema":"rd22.verifier-manifest.v001","stdout_discipline":{"format":"canonical-json","lines":1,"other_output_permitted":false},"verifier_root_sha256":"e3abd168dfdaacd16c29ee1bd7eb857409a1dd7c9749916e5957fe9b6b1a9314"}